free_chess_gui/leelaz_opencl_tuning
0;XgemmBatched;256;256;256;16; -DKWG=32 -DKWI=2 -DMDIMA=16 -DMDIMC=16 -DMWG=64 -DNDIMB=16 -DNDIMC=16 -DNWG=64 -DSA=1 -DSB=1 -DSTRM=0 -DSTRN=0 -DVWM=4 -DVWN=4;OpenCL: Advanced Micro Devices, Inc. Ellesmere @ 1560MHz
